{
  "regulationId": "championsregmc",
  "regulationName": "Reg M-C",
  "baseRegulationId": "championsregmb",
  "begin": null,
  "end": null,
  "overrides": {
    "roster": {
      "absolmegaz": {},
      "arboliva": {},
      "baxcalibur": {},
      "baxcaliburmega": {},
      "cinderace": {},
      "farfetchd": {},
      "garchompmegaz": {},
      "gogoat": {},
      "golisopod": {},
      "golisopodmega": {},
      "grapploct": {},
      "indeedee": {},
      "indeedeef": {},
      "inteleon": {},
      "lucariomegaz": {},
      "mabosstiff": {},
      "mrmime": {},
      "pawmot": {},
      "perrserker": {},
      "persian": {},
      "persianalola": {},
      "pincurchin": {},
      "rillaboom": {},
      "salamence": {},
      "salamencemega": {},
      "sirfetchd": {},
      "squawkabilly": {},
      "squawkabillyblue": {},
      "squawkabillywhite": {},
      "squawkabillyyellow": {},
      "swalot": {},
      "thievul": {},
      "toxtricity": {},
      "toxtricitylowkey": {},
      "wigglytuff": {}
    },
    "learnsets": {
      "absolmegaz": {
        "dexNumber": 359,
        "form": "Mega-Z",
        "moves": [
          "aerialace",
          "airslash",
          "assurance",
          "attract",
          "batonpass",
          "bite",
          "blizzard",
          "bodyslam",
          "bounce",
          "brutalswing",
          "calmmind",
          "closecombat",
          "confuseray",
          "curse",
          "darkpulse",
          "detect",
          "doubleedge",
          "doubleteam",
          "endure",
          "facade",
          "feint",
          "fireblast",
          "flamethrower",
          "focusenergy",
          "foulplay",
          "futuresight",
          "gigaimpact",
          "hex",
          "hyperbeam",
          "icebeam",
          "icywind",
          "irontail",
          "knockoff",
          "meanlook",
          "megahorn",
          "nightslash",
          "payback",
          "perishsong",
          "phantomforce",
          "playrough",
          "protect",
          "psychocut",
          "quickattack",
          "raindance",
          "rest",
          "rockslide",
          "rocktomb",
          "round",
          "sandstorm",
          "shadowball",
          "shadowclaw",
          "shadowsneak",
          "slash",
          "sleeptalk",
          "snarl",
          "snore",
          "stoneedge",
          "substitute",
          "suckerpunch",
          "sunnyday",
          "superpower",
          "swordsdance",
          "taunt",
          "thief",
          "throatchop",
          "thunder",
          "thunderbolt",
          "thunderwave",
          "trailblaze",
          "willowisp",
          "xscissor",
          "zenheadbutt"
        ],
        "sources": [
          "smogon/pokemon-showdown"
        ]
      },
      "arboliva": {
        "dexNumber": 930,
        "form": null,
        "moves": [
          "alluringvoice",
          "bulletseed",
          "charm",
          "dazzlinggleam",
          "earthpower",
          "encore",
          "endure",
          "energyball",
          "facade",
          "flail",
          "fling",
          "gigadrain",
          "gigaimpact",
          "grassknot",
          "grassyterrain",
          "growth",
          "helpinghand",
          "hyperbeam",
          "hypervoice",
          "leafstorm",
          "leechseed",
          "lightscreen",
          "memento",
          "mirrorcoat",
          "petalblizzard",
          "petaldance",
          "pollenpuff",
          "protect",
          "psychup",
          "reflect",
          "rest",
          "safeguard",
          "seedbomb",
          "sleeptalk",
          "solarbeam",
          "solarblade",
          "strengthsap",
          "substitute",
          "sunnyday",
          "sweetscent",
          "synthesis",
          "terrainpulse",
          "trailblaze",
          "weatherball"
        ],
        "sources": [
          "smogon/pokemon-showdown"
        ]
      },
      "archaludon": {
        "moves": [
          "aurasphere",
          "bodyslam",
          "breakingswipe",
          "brickbreak",
          "darkpulse",
          "doubleedge",
          "dracometeor",
          "dragoncheer",
          "dragonclaw",
          "dragonpulse",
          "dragontail",
          "earthquake",
          "electroshot",
          "endure",
          "facade",
          "flashcannon",
          "focusenergy",
          "foulplay",
          "gigaimpact",
          "gyroball",
          "hardpress",
          "heavyslam",
          "hyperbeam",
          "irondefense",
          "ironhead",
          "lightscreen",
          "metalsound",
          "meteorbeam",
          "nightslash",
          "outrage",
          "protect",
          "reflect",
          "rest",
          "roar",
          "rockslide",
          "rocktomb",
          "scaryface",
          "slash",
          "sleeptalk",
          "smackdown",
          "snarl",
          "solarbeam",
          "stealthrock",
          "steelbeam",
          "stoneedge",
          "substitute",
          "swordsdance",
          "thunder",
          "thunderbolt",
          "thunderwave"
        ]
      },
      "baxcalibur": {
        "dexNumber": 998,
        "form": null,
        "moves": [
          "aerialace",
          "aquatail",
          "avalanche",
          "bite",
          "blizzard",
          "bodypress",
          "bodyslam",
          "breakingswipe",
          "brickbreak",
          "bulldoze",
          "crunch",
          "dig",
          "doubleedge",
          "dracometeor",
          "dragoncheer",
          "dragonclaw",
          "dragondance",
          "dragonpulse",
          "dragonrush",
          "dragontail",
          "earthquake",
          "endure",
          "facade",
          "focusenergy",
          "freezedry",
          "frostbreath",
          "gigaimpact",
          "glaiverush",
          "helpinghand",
          "highhorsepower",
          "hyperbeam",
          "icebeam",
          "icefang",
          "iceshard",
          "iciclecrash",
          "iciclespear",
          "icywind",
          "ironhead",
          "outrage",
          "protect",
          "raindance",
          "rest",
          "scaleshot",
          "scaryface",
          "sleeptalk",
          "snowscape",
          "stompingtantrum",
          "substitute",
          "swordsdance",
          "thunderfang",
          "zenheadbutt"
        ],
        "sources": [
          "smogon/pokemon-showdown"
        ]
      },
      "baxcaliburmega": {
        "dexNumber": 998,
        "form": "Mega",
        "moves": [
          "aerialace",
          "aquatail",
          "avalanche",
          "bite",
          "blizzard",
          "bodypress",
          "bodyslam",
          "breakingswipe",
          "brickbreak",
          "bulldoze",
          "crunch",
          "dig",
          "doubleedge",
          "dracometeor",
          "dragoncheer",
          "dragonclaw",
          "dragondance",
          "dragonpulse",
          "dragonrush",
          "dragontail",
          "earthquake",
          "endure",
          "facade",
          "focusenergy",
          "freezedry",
          "frostbreath",
          "gigaimpact",
          "glaiverush",
          "helpinghand",
          "highhorsepower",
          "hyperbeam",
          "icebeam",
          "icefang",
          "iceshard",
          "iciclecrash",
          "iciclespear",
          "icywind",
          "ironhead",
          "outrage",
          "protect",
          "raindance",
          "rest",
          "scaleshot",
          "scaryface",
          "sleeptalk",
          "snowscape",
          "stompingtantrum",
          "substitute",
          "swordsdance",
          "thunderfang",
          "zenheadbutt"
        ],
        "sources": [
          "smogon/pokemon-showdown"
        ]
      },
      "cinderace": {
        "dexNumber": 815,
        "form": null,
        "moves": [
          "acrobatics",
          "agility",
          "assurance",
          "batonpass",
          "blastburn",
          "blazekick",
          "bounce",
          "bulkup",
          "burningjealousy",
          "coaching",
          "counter",
          "courtchange",
          "doubleedge",
          "electroball",
          "endure",
          "facade",
          "feint",
          "fireblast",
          "firefang",
          "firepunch",
          "firespin",
          "flamecharge",
          "flamethrower",
          "flareblitz",
          "fling",
          "focusblast",
          "focusenergy",
          "gigaimpact",
          "gunkshot",
          "heatwave",
          "helpinghand",
          "highjumpkick",
          "hyperbeam",
          "ironhead",
          "lowkick",
          "lowsweep",
          "megakick",
          "mudshot",
          "mudslap",
          "overheat",
          "protect",
          "pyroball",
          "quickattack",
          "rest",
          "reversal",
          "round",
          "scorchingsands",
          "shadowball",
          "sleeptalk",
          "smackdown",
          "snarl",
          "snore",
          "substitute",
          "suckerpunch",
          "sunnyday",
          "superfang",
          "swordsdance",
          "taunt",
          "temperflare",
          "trailblaze",
          "uturn",
          "weatherball",
          "willowisp",
          "zenheadbutt"
        ],
        "sources": [
          "smogon/pokemon-showdown"
        ]
      },
      "farfetchd": {
        "dexNumber": 83,
        "form": null,
        "moves": [
          "acrobatics",
          "aerialace",
          "agility",
          "aircutter",
          "airslash",
          "attract",
          "batonpass",
          "bodyslam",
          "bravebird",
          "brutalswing",
          "closecombat",
          "covet",
          "curse",
          "dualwingbeat",
          "endure",